{"k":"perch_report","v":1,"generated_s":1792972800.0,"input":{"perch_records":22,"perch_windows":11,"birds_rows":8,"excluded_human_voice":2},"min_logit":1.0,"windows":{"total":9,"both_same_species":3,"both_same_genus":1,"both_differ":2,"perch_only":1,"birds_only":1,"both_silent":1},"agreement":{"compared":6,"agree":3,"rate":0.5},"per_species":[{"key":"cyanocitta cristata","compared":1,"agree":0,"rate":0.0},{"key":"melanerpes carolinus","compared":1,"agree":0,"rate":0.0},{"key":"poecile atricapillus","compared":1,"agree":1,"rate":1.0},{"key":"poecile carolinensis","compared":3,"agree":2,"rate":0.6667}],"by_beam":[{"key":2,"compared":2,"agree":0,"rate":0.0},{"key":4,"compared":2,"agree":2,"rate":1.0},{"key":5,"compared":2,"agree":1,"rate":0.5}],"by_confidence_bin":[{"key":"0.50-0.70","compared":2,"agree":0,"rate":0.0},{"key":"0.70-0.85","compared":1,"agree":0,"rate":0.0},{"key":"0.85-1.00","compared":3,"agree":3,"rate":1.0}],"by_hour_utc":[{"key":0,"compared":4,"agree":2,"rate":0.5},{"key":1,"compared":2,"agree":1,"rate":0.5}],"disagreements":{"total":3,"listed":3,"items":[{"event_id":"1792972829000-poecile-carolinensis","t":1792972830.0,"beam":2,"birdnet":{"species":"Poecile carolinensis","common":"Carolina Chickadee","score":0.6},"perch":{"species":"Poecile atricapillus","logit":6.1},"same_genus":true},{"event_id":"1792972839000-melanerpes-carolinus","t":1792972840.0,"beam":2,"birdnet":{"species":"Melanerpes carolinus","common":"Red-bellied Woodpecker","score":0.55},"perch":{"species":"Cyanocitta cristata","logit":5.0},"same_genus":false},{"event_id":"1792976419000-cyanocitta-cristata","t":1792976420.0,"beam":5,"birdnet":{"species":"Cyanocitta cristata","common":"Blue Jay","score":0.72},"perch":{"species":"Poecile atricapillus","logit":6.0},"same_genus":false}]},"coverage":{"birdnet_species":4,"named_by_perch":3,"never_named":[{"key":"melanerpes carolinus","common":"Red-bellied Woodpecker","reports":1}]},"perch_top1_groups":{"bird":9}}
